repo_name,repo_description,repo_stars,repo_url
machine-learning-systems-design,"A booklet on machine learning systems design with exercises. NOT the repo for the book ""Designing Machine Learning Systems""",9392,https://github.com/chiphuyen/machine-learning-systems-design
golearn,Machine Learning for Go,9385,https://github.com/sjwhitworth/golearn
pycaret,"An open-source, low-code machine learning library in Python",9295,https://github.com/pycaret/pycaret
handson-ml3,"A series of Jupyter notebooks that walk you through the fundamentals of Machine Learning and Deep Learning in Python using Scikit-Learn, Keras and TensorFlow 2.",9234,https://github.com/ageron/handson-ml3
machinelearning,ML.NET is an open source and cross-platform machine learning framework for .NET.,9166,https://github.com/dotnet/machinelearning
state-of-the-art-result-for-machine-learning-problems,"This repository provides state of the art (SoTA) results for all machine learning problems. We do our best to keep this repository up to date.  If you do find a problem's SoTA result is out of date or missing, please raise this as an issue or submit Google form (with this information: research paper name, dataset, metric, source code and year). We will fix it immediately.",8941,https://github.com/RedditSota/state-of-the-art-result-for-machine-learning-problems
pattern,"Web mining module for Python, with tools for scraping, natural language processing, machine learning, network analysis and visualization.",8809,https://github.com/clips/pattern
machine-learning-notes,"My continuously updated Machine Learning, Probabilistic Models and Deep Learning notes and demos (2000+ slides)  我不间断更新的机器学习，概率模型和深度学习的讲义(2000+页)和视频链接",8635,https://github.com/roboticcam/machine-learning-notes
Stock-Prediction-Models,Gathers machine learning and deep learning models for Stock forecasting including trading bots and simulations,8621,https://github.com/huseinzol05/Stock-Prediction-Models
machine_learning_examples,A collection of machine learning examples and tutorials.,8580,https://github.com/lazyprogrammer/machine_learning_examples
cog,Containers for machine learning,8565,https://github.com/replicate/cog
vowpal_wabbit,"Vowpal Wabbit is a machine learning system which pushes the frontier of machine learning with techniques such as online, hashing, allreduce, reductions, learning2search, active, and interactive learning.  ",8556,https://github.com/VowpalWabbit/vowpal_wabbit
machinelearning,My blogs and code for machine learning. http://cnblogs.com/pinard,8519,https://github.com/ljpzzz/machinelearning
catboost,"A fast, scalable, high performance Gradient Boosting on Decision Trees library, used for ranking, classification, regression and other machine learning tasks for Python, R, Java, C++. Supports computation on CPU and GPU.",8368,https://github.com/catboost/catboost
sktime,A unified framework for machine learning with time series,8359,https://github.com/sktime/sktime
awesome-project-ideas,"Curated list of Machine Learning, NLP, Vision, Recommender Systems Project Ideas",8258,https://github.com/NirantK/awesome-project-ideas
Machine-Learning-Collection,A resource for learning about Machine learning & Deep Learning,8064,https://github.com/aladdinpersson/Machine-Learning-Collection
cortex,Production infrastructure for machine learning at scale,8032,https://github.com/cortexlabs/cortex
approachingalmost,Approaching (Almost) Any Machine Learning Problem,7900,https://github.com/abhishekkrthakur/approachingalmost
auto-sklearn,Automated Machine Learning with scikit-learn,7817,https://github.com/automl/auto-sklearn
financial-machine-learning,A curated list of practical financial machine learning tools and applications.,7790,https://github.com/firmai/financial-machine-learning
machine-learning-yearning-cn,Machine Learning Yearning 中文版 - 《机器学习训练秘籍》 - Andrew Ng 著,7788,https://github.com/deeplearning-ai/machine-learning-yearning-cn
machine-learning-cheat-sheet,Classical equations and diagrams in machine learning,7708,https://github.com/soulmachine/machine-learning-cheat-sheet
MachineLearning_Python,机器学习算法python实现,7699,https://github.com/lawlite19/MachineLearning_Python
introduction_to_ml_with_python,"Notebooks and code for the book ""Introduction to Machine Learning with Python""",7689,https://github.com/amueller/introduction_to_ml_with_python
machine-learning-roadmap,"A roadmap connecting many of the most important concepts in machine learning, how to learn them and what tools to use to perform them.",7660,https://github.com/mrdbourke/machine-learning-roadmap
Learn_Machine_Learning_in_3_Months,"This is the code for ""Learn Machine Learning in 3 Months"" by Siraj Raval on Youtube ",7603,https://github.com/llSourcell/Learn_Machine_Learning_in_3_Months
awesome-ml-for-cybersecurity, :octocat: Machine Learning for Cyber Security,7521,https://github.com/jivoi/awesome-ml-for-cybersecurity
Machine-learning-learning-notes,周志华《机器学习》又称西瓜书是一本较为全面的书籍，书中详细介绍了机器学习领域不同类型的算法(例如：监督学习、无监督学习、半监督学习、强化学习、集成降维、特征选择等)，记录了本人在学习过程中的理解思路与扩展知识点，希望对新人阅读西瓜书有所帮助！,7456,https://github.com/Vay-keen/Machine-learning-learning-notes
facets,Visualizations for machine learning datasets,7369,https://github.com/PAIR-code/facets
industry-machine-learning,A curated list of applied machine learning and data science notebooks and libraries across different industries (by @firmai),7342,https://github.com/firmai/industry-machine-learning
